Exercise 3 - SELECT
mysql> select * from Entry;
+----+---------------+-----------+----------+---------------------+------+---------+----------------+----------------+------------------+-----------------+-----------------+
| id | addressBookId | firstName | lastName | birthday            | type | subtype | contentLineOne | contentLineTwo | contentLineThree | contentLineFour | contentLineFive |
+----+---------------+-----------+----------+---------------------+------+---------+----------------+----------------+------------------+-----------------+-----------------+
|  1 |             1 | Yaron     | Cohen    | 0000-00-00 00:00:00 | work | phone   | 778-316-2479   | and            | we               | are             | ready           |
|  2 |             2 | John      | Smith    | 0000-00-00 00:00:00 | work | phone   | 778-316-2499   | and            | we               | are             | ready           |
|  3 |             2 | James     | Clark    | 1985-12-09 00:00:00 | work | phone   | 778-322-2399   | and            | we               | are             | ready           |
+----+---------------+-----------+----------+---------------------+------+---------+----------------+----------------+------------------+-----------------+-----------------+
3 rows in set (0.00 sec)

mysql> select * from AddressBook;
+----+-----------+-------+---------------------+---------------------+
| id | accountId | name  | createdOn           | modifiedOn          |
+----+-----------+-------+---------------------+---------------------+
|  1 |         1 | Yaron | 2016-01-01 00:00:00 | 2016-01-01 00:00:00 |
+----+-----------+-------+---------------------+---------------------+
1 row in set (0.00 sec)

mysql> select * from Account;
+----+--------------------+----------+---------------------+---------------------+
| id | email              | password | createdOn           | modifiedOn          |
+----+--------------------+----------+---------------------+---------------------+
|  1 | yaroncnk@gmail.com | yrnchn11 | 2016-01-01 00:00:00 | 2016-01-01 00:00:00 |
+----+--------------------+----------+---------------------+---------------------+
1 row in set (0.00 sec)

Exercise 4 - UPDATE
mysql> select * from Account;
+----+--------------------+----------+---------------------+---------------------+
| id | email              | password | createdOn           | modifiedOn          |
+----+--------------------+----------+---------------------+---------------------+
|  1 | yaroncnk@gmail.com | yrnchn11 | 2016-02-01 00:00:00 | 2016-07-01 00:00:00 |
+----+--------------------+----------+---------------------+---------------------+
1 row in set (0.00 sec)

mysql> select * from Entry;
+----+---------------+-----------+----------+---------------------+------+---------+----------------+----------------+------------------+-----------------+-----------------+
| id | addressBookId | firstName | lastName | birthday            | type | subtype | contentLineOne | contentLineTwo | contentLineThree | contentLineFour | contentLineFive |
+----+---------------+-----------+----------+---------------------+------+---------+----------------+----------------+------------------+-----------------+-----------------+
|  1 |             1 | Yaron     | Cohen    | 1956-02-01 00:00:00 | work | phone   | 778-316-2479   | and            | we               | are             | ready           |
|  2 |             2 | John      | Smith    | 1956-02-01 00:00:00 | work | phone   | 778-316-2499   | and            | we               | are             | ready           |
|  3 |             2 | James     | Clark    | 1956-02-01 00:00:00 | work | phone   | 778-322-2399   | and            | we               | are             | ready           |
+----+---------------+-----------+----------+---------------------+------+---------+----------------+----------------+------------------+-----------------+-----------------+
3 rows in set (0.00 sec)

mysql> select * from AddressBook;
+----+-----------+-------+---------------------+---------------------+
| id | accountId | name  | createdOn           | modifiedOn          |
+----+-----------+-------+---------------------+---------------------+
|  1 |         1 | Yaron | 2016-02-01 00:00:00 | 2016-07-01 00:00:00 |
+----+-----------+-------+---------------------+---------------------+
1 row in set (0.00 sec)

Exercise 5 - Deleting
TRUNCATE Enty;

Exercise 6 - Deleting
DELETE from Account;

Exercise 8 - Answers
mysql> SELECT
    ->     email
    -> FROM
    ->     Account
    -> WHERE
    ->     id = 63; 
+-------------------------------------------------+
| email                                           |
+-------------------------------------------------+
| consectetuer.rhoncus.Nullam@temporloremeget.org |
+-------------------------------------------------+
1 row in set (0.00 sec)

mysql> SELECT
    ->     name
    -> FROM
    ->     AddressBook
    -> WHERE
    ->     AccountId = 3;
+---------------------------------+
| name                            |
+---------------------------------+
| Donec Incorporated              |
| Ipsum Nunc LLC                  |
| In Consectetuer Ltd             |
| Lacus Aliquam Rutrum Industries |
| Ac Ltd                          |
| Mauris Consulting               |
| Ornare Corporation              |
+---------------------------------+
7 rows in set (0.00 sec)

mysql> SELECT
    ->     createdOn
    -> FROM
    ->     AddressBook
    -> WHERE
    ->     name = 'Lorem Foundation';
+---------------------+
| createdOn           |
+---------------------+
| 2016-06-26 02:43:41 |
| 2015-05-04 14:28:16 |
+---------------------+
2 rows in set (0.00 sec)

Exercise 9 - Count
mysql> SELECT
    ->     count(*)
    -> FROM
    ->     Account;
+----------+
| count(*) |
+----------+
|     1000 |
+----------+
1 row in set (0.00 sec)

mysql> SELECT     count(*) FROM     AddressBook;                                                                                                                 
+----------+
| count(*) |
+----------+
|     1100 |
+----------+
1 row in set (0.00 sec)

mysql> SELECT     count(*) FROM     Entry;                                                                                                                       
+----------+
| count(*) |
+----------+
|     4000 |
+----------+
1 row in set (0.00 sec)

